{
  "game_id": "demo",
  "content_id": "demo:item/pony-whistle",
  "revision": 1,
  "schema_version": 1,
  "public": {
    "game_id": "demo",
    "content_id": "demo:item/pony-whistle",
    "revision": 1,
    "schema_version": 1,
    "item_type": "consumable",
    "display_name": "小马哨",
    "description": "吹响后获得一匹小马。",
    "icon_id": "demo:icon/placeholder",
    "stack_limit": 5,
    "price_minor": "200"
  },
  "server": {
    "reward_value_minor": "0",
    "drop_weight_basis_points": 0
  }
}
