{
  "game_id": "demo",
  "content_id": "demo:item/wooden-sword",
  "revision": 1,
  "schema_version": 1,
  "public": {
    "game_id": "demo",
    "content_id": "demo:item/wooden-sword",
    "revision": 1,
    "schema_version": 1,
    "item_type": "equipment",
    "display_name": "木剑",
    "description": "练习用木剑。",
    "icon_id": "demo:icon/placeholder",
    "stack_limit": 1,
    "price_minor": "30"
  },
  "server": {
    "reward_value_minor": "0",
    "drop_weight_basis_points": 0
  }
}
